{
  "schema": "kgdistiller-static-export-v1",
  "status": "exported",
  "producer": {
    "name": "kgdistiller",
    "repository": "https://github.com/example/kgdistiller",
    "version": "1.0.0",
    "commit": "bbbbbbbbbbbbbbbbbbbbbbbbbbbbbbbbbbbbbbbb"
  },
  "source": {
    "repository": "https://github.com/example/notes",
    "revision": "cccccccccccccccccccccccccccccccccccccccc",
    "digest": "dddddddddddddddddddddddddddddddddddddddddddddddddddddddddddddddd",
    "files": 1,
    "published_digest": "eeeeeeeeeeeeeeeeeeeeeeeeeeeeeeeeeeeeeeeeeeeeeeeeeeeeeeeeeeeeeeee",
    "published_files": 1,
    "published_hashes": {
      "notes/example.md": "ffffffffffffffffffffffffffffffffffffffffffffffffffffffffffffffff"
    }
  },
  "visibility": {
    "policy": "explicit-publish",
    "published_sources": ["notes"],
    "excluded_sources": 0
  },
  "graph": {
    "private_schema": "kgdistiller-graph-v2",
    "private_sha256": "aaaaaaaaaaaaaaaaaaaaaaaaaaaaaaaaaaaaaaaaaaaaaaaaaaaaaaaaaaaaaaaa",
    "private_counts": {"nodes": 0, "edges": 0, "references": 0},
    "public_schema": "kgdistiller-site-graph-v1",
    "public_sha256": "ccae7880989859fbeb6b19523e12ab40b23245cd72e7c496bfb2f48fad1bfc94",
    "public_counts": {"nodes": 0, "edges": 0, "references": 0}
  },
  "artifacts": [
    {"kind": "site-graph", "path": "graph.json", "bytes": 2, "sha256": "1111111111111111111111111111111111111111111111111111111111111111"},
    {"kind": "typst-registry", "path": "knowledge-registry.typ", "bytes": 2, "sha256": "2222222222222222222222222222222222222222222222222222222222222222"},
    {"kind": "standalone-verifier", "path": "verify_export.py", "bytes": 2, "sha256": "3333333333333333333333333333333333333333333333333333333333333333"}
  ],
  "export_sha256": "239f0842fee3a168aaa598882fc917ae7bdfd66d865c6fb9eb6f6f3c88a28562"
}
